{
  "archetype": "act",
  "artifact_refs": [
    "reference-suite/s3-act/fixtures/initial-state.json",
    "reference-suite/s3-act/fixtures/target-state.json",
    "reference-suite/s3-act/fixtures/rollback-state.json",
    "scripts/reference_staging_service.py"
  ],
  "bundle_id": "bundle-s3-act-a",
  "bundle_version": "0.1.0",
  "controls": {
    "approval_mode": "A",
    "deny_rules": [
      "no-production-promotion",
      "no-cross-environment-write"
    ],
    "egress": "iron-proxy-staging",
    "managed_scope": "s3-act-staging-only",
    "sandbox": "local-synthetic-staging"
  },
  "description": "S3 Act A-run \u2014 pre-authorized staging rate-limit change after ratified H seed",
  "governance": {
    "approval_record_id": "ADR-B07-S3-A-20260806",
    "effective_date": "2026-08-06",
    "h_seed_requirement": "s3-act-h-20260806-dry-run",
    "owner": "nimbus-platform-owner-synthetic",
    "review_date": "2026-11-06",
    "supersedes": "bundle-s3-act-h@0.1.0"
  },
  "hermes_profile": {
    "distribution_ref": "hermes-agent:v2026.8.3/profile-act-staging-rate-limit",
    "security_posture": "sandbox-staging-write"
  },
  "limits": {
    "action_class": "act-rate-limit-change",
    "authority_ceiling": "A",
    "consequence_class": "bounded-staging-config",
    "data_zone": "synthetic-staging",
    "reversibility": "fully_reversible"
  },
  "manifest": {
    "canonicalization": "json-canonical-v1",
    "sha256": "f812d9637ebefba8277bfe89fff180594767a6dacb09596618a9aa469fca8753"
  },
  "runtime": {
    "auxiliary_model": null,
    "effort": "not-applicable",
    "fallback_chain": [],
    "model": "dry-run-producer-v1",
    "provider_constraint": "configured-local-only"
  },
  "schema_version": "0.1",
  "verifier": {
    "required_dispositions": [
      "deterministic-oracle",
      "role-separated",
      "human"
    ],
    "topology": "target-readback-oracle-human"
  }
}
