{
  "archetype": "act",
  "artifact_refs": [
    "reference-suite/s3-act/fixtures/initial-state.json",
    "reference-suite/s3-act/fixtures/rollback-state.json",
    "reference-suite/s3-act/fixtures/target-state.json",
    "scripts/deployment_lab_act_client.py",
    "scripts/deployment_lab_backend.py",
    "scripts/reference_staging_service.py"
  ],
  "bundle_id": "bundle-s3-act-h",
  "bundle_version": "0.1.0",
  "controls": {
    "approval_mode": "H",
    "deny_rules": [
      "no-production-promotion",
      "no-cross-environment-write"
    ],
    "egress": "iron-proxy-staging",
    "managed_scope": "s3-act-staging-only",
    "sandbox": "local-synthetic-staging"
  },
  "description": "S3 Act H-seed \u2014 first-occurrence human release for staging rate-limit change",
  "governance": {
    "approval_record_id": "ADR-B07-S3-H-20260806",
    "effective_date": "2026-08-06",
    "owner": "nimbus-platform-owner-synthetic",
    "review_date": "2026-11-06",
    "supersedes": null
  },
  "hermes_profile": {
    "distribution_ref": "hermes-agent:v2026.8.3/profile-act-staging-rate-limit",
    "security_posture": "sandbox-staging-write"
  },
  "limits": {
    "action_class": "act-rate-limit-change",
    "authority_ceiling": "H",
    "consequence_class": "bounded-staging-config",
    "data_zone": "synthetic-staging",
    "reversibility": "fully_reversible"
  },
  "manifest": {
    "canonicalization": "json-canonical-v1",
    "sha256": "10b120c8f241587de1a96ddf17ed5eee1208cfb3c339b21272134440b733ccbd"
  },
  "runtime": {
    "auxiliary_model": null,
    "effort": "not-applicable",
    "fallback_chain": [],
    "model": "dry-run-producer-v1",
    "provider_constraint": "configured-local-only"
  },
  "schema_version": "0.1",
  "verifier": {
    "required_dispositions": [
      "deterministic-oracle",
      "role-separated",
      "human"
    ],
    "topology": "target-readback-oracle-human"
  }
}
