{
  "archetype": "coordinate",
  "artifact_refs": [
    "reference-suite/s2-coordinate/fixtures/fictional-org.json",
    "reference-suite/s2-coordinate/fixtures/systems-inventory.json",
    "reference-suite/s2-coordinate/fixtures/employee-case.json",
    "reference-suite/s2-coordinate/expected-oracle.json",
    "desk-probe/protocol.json",
    "desk-probe/public-rubric.json",
    "desk-probe/operator-brief.md"
  ],
  "bundle_id": "bundle-s2-coordinate",
  "bundle_version": "0.1.0",
  "controls": {
    "approval_mode": "H",
    "deny_rules": [
      "no-destructive-effects",
      "no-production-credentials",
      "no-external-send"
    ],
    "egress": "none",
    "managed_scope": "s2-coordinate-offboarding",
    "sandbox": "sandbox-coordination"
  },
  "description": "S2 Coordinate \u2014 synthetic employee offboarding packet (bounded coordination, no destructive execution)",
  "governance": {
    "approval_record_id": "ADR-B13-S2-20260806",
    "effective_date": "2026-08-06",
    "owner": "nimbus-hr-owner-synthetic",
    "review_date": "2026-11-06",
    "supersedes": null
  },
  "hermes_profile": {
    "distribution_ref": "hermes-agent:v2026.8.3/profile-coordinate-offboarding",
    "security_posture": "sandbox-coordination"
  },
  "limits": {
    "action_class": "coordinate-employee-offboarding",
    "authority_ceiling": "H",
    "consequence_class": "coordination-only",
    "data_zone": "synthetic-internal",
    "reversibility": "fully_reversible"
  },
  "manifest": {
    "canonicalization": "json-canonical-v1",
    "sha256": "9b9b0f5666f4155448aa9a7c0b97afb519f192b01e579faac1ff0489bf1de62d"
  },
  "runtime": {
    "auxiliary_model": null,
    "effort": "not-applicable",
    "fallback_chain": [],
    "model": "dry-run-producer-v1",
    "provider_constraint": "configured-local-only"
  },
  "schema_version": "0.1",
  "verifier": {
    "required_dispositions": [
      "deterministic-oracle",
      "role-separated",
      "human"
    ],
    "topology": "operator-packet-then-public-rubric-then-evaluator"
  }
}
